Movie_ID,Title,Genre,Release_Year,Duration,Rating,IMDb_Rating,Votes,Director,Country,Language,Budget,Revenue,Date_Added,Age_Rating,Cast,Production_House
NF7860,The Social Network,Sci-Fi,2014,112,9.2,8.7,1638184,,Germany,Italian,77479266.0,1502740412.0,2018-01-17,R,"Chris Evans, Jodie Foster, Will Smith",Legendary Pictures
NF3290,Zack Snyder'S Justice League,Thriller,2001,156,4.2,7.9,1538044,,India,Spanish,241049071.0,,2022-01-09,R,"Robert De Niro, Will Smith",Blumhouse Productions
NF8104,The Dark Knight,Documentary,2016,168,6.8,4.4,981573,,Italy,Korean,23873364.0,,2023-05-05,PG-13,"Dwayne Johnson, Ryan Reynolds, Angelina Jolie",Columbia Pictures
NF9579,Parasite,Action,2024,134,6.0,6.2,1893809,Zack Snyder,Germany,Korean,4365602.0,356694222.0,2024-05-03,TV-MA,"Adam Driver, Meryl Streep, Scarlett Johansson, Al Pacino",Pixar Animation Studios
NF7429,Like Father,Thriller,1990,101,6.1,4.7,417810,Chloé Zhao,United Kingdom,Italian,84281219.0,340715464.0,2015-12-18,NC-17,"Dwayne Johnson, Sandra Bullock, Lupita Nyong'o",Netflix Originals
NF7130,Mass,Documentary,2010,118,5.4,4.2,1379884,Park Chan-wook,South Korea,Japanese,121926921.0,1018362228.0,2020-03-06,PG-13,"Zendaya, Brad Pitt",Blumhouse Productions
NF8399,Army Of Thieves,Crime,2021,158,7.2,3.4,1883784,Akira Kurosawa,India,Spanish,136338731.0,,2020-11-05,PG-13,"Angelina Jolie, Lupita Nyong'o, Al Pacino",DC Films
NF6006,The Suicide Squad,Fantasy,2024,138,8.5,6.2,361261,Sam Raimi,United States,Italian,198686981.0,304781734.0,2024-06-09,TV-MA,"Leonardo DiCaprio, Chris Evans, Tom Hanks, Cate Blanchett",A24
NF8276,His House,Sci-Fi,1991,139,6.4,5.3,1024666,Patty Jenkins,Italy,German,21265348.0,1501038270.0,2021-03-26,R,"Viola Davis, Timothée Chalamet, Margot Robbie",HBO Films
NF1924,Work It,Romance,1993,118,4.8,4.8,742251,Ryan Coogler,South Korea,Hindi,73466638.0,33281820.0,2024-04-18,TV-14,"Dwayne Johnson, Ana de Armas, Cate Blanchett",20th Century Studios
NF1231,Da 5 Bloods,Sci-Fi,2017,137,9.1,9.5,1036243,Quentin Tarantino,United States,Korean,34065893.0,1511711188.0,2021-08-08,PG,"Will Smith, Margot Robbie",DreamWorks Animation
NF9656,Goodfellas,Adventure,1991,106,8.7,3.4,1141733,,South Korea,French,51599737.0,1663732826.0,2020-12-08,TV-14,"Chris Evans, Leonardo DiCaprio",Blumhouse Productions
NF3495,Ford V Ferrari,Animation,2002,164,5.7,9.2,610179,Peter Jackson,United Kingdom,Korean,51092298.0,1767403507.0,2017-10-28,TV-14,"Brad Pitt, Adam Driver, Robert De Niro",HBO Films
NF6697,Kate,Comedy,2013,131,7.3,4.1,839337,Denis Villeneuve,Italy,Korean,,1748976178.0,2019-07-14,R,"Sandra Bullock, Leonardo DiCaprio",DreamWorks Animation
NF7182,The Favourite,Crime,2008,198,8.8,6.1,1591810,Jane Campion,Germany,Japanese,14352745.0,1605038913.0,2021-09-04,NC-17,"Robert Downey Jr., Timothée Chalamet",Focus Features
NF4106,Thunder Force,Fantasy,2007,137,8.6,6.8,1463989,Wong Kar-wai,United Kingdom,Spanish,45971089.0,888685681.0,2015-02-02,TV-14,,Legendary Pictures
NF8235,Goodfellas,Fantasy,1995,143,8.1,7.6,70556,Jordan Peele,South Korea,French,,540039339.0,2018-07-09,TV-14,"Ryan Reynolds, Robert Downey Jr., Will Smith",New Line Cinema
NF4568,Avengers Endgame,Crime,2007,143,6.7,5.3,619604,Jordan Peele,United Kingdom,French,219075096.0,866055481.0,2015-09-20,PG,"Michael B. Jordan, Florence Pugh",DreamWorks Animation
NF6834,Welcome To Chechnya,Thriller,2021,137,4.1,7.8,403268,James Gunn,Italy,Korean,242162179.0,1982310155.0,2020-10-24,NC-17,"Cate Blanchett, Viola Davis, Natalie Portman, Jodie Foster",DreamWorks Animation
NF2902,The Matrix,Romance,1990,137,8.7,5.2,1424699,Coen Brothers,Germany,French,,678546400.0,2017-05-27,TV-PG,"Ryan Reynolds, Morgan Freeman",Universal Pictures
NF9518,The Social Network,Crime,2006,135,7.7,7.4,755549,James Cameron,Japan,Korean,62118800.0,586519133.0,2015-09-18,R,"Chris Evans, Tom Hanks",New Line Cinema
NF4913,C'Mon C'Mon,Crime,2022,105,9.2,9.6,1014080,David Lynch,Italy,German,63318909.0,,2018-09-26,TV-PG,"Meryl Streep, Natalie Portman, Angelina Jolie",DreamWorks Animation
NF7122,Red Notice,Animation,1992,84,8.5,6.2,609659,Spike Lee,Japan,French,124591959.0,749438568.0,2022-08-21,TV-PG,"Brad Pitt, Julia Roberts",Marvel Studios
NF2833,Tick Tick Boom,Thriller,1999,131,8.3,5.0,994127,,France,Spanish,127064418.0,,2022-10-08,TV-14,"Charlize Theron, Leonardo DiCaprio",DC Films
NF6920,Avengers Endgame,Crime,2007,123,4.6,7.1,1024666,Bong Joon-ho,Italy,French,166664330.0,1557778678.0,2022-04-18,G,"Sandra Bullock, Zendaya",Apple TV+
NF6727,Birds Of Prey,Horror,2016,162,6.8,6.2,736928,Tim Burton,United Kingdom,Hindi,135737834.0,96193925.0,2019-01-21,TV-MA,"Scarlett Johansson, Meryl Streep",Warner Bros.
NF1496,Drive My Car,Comedy,2008,117,8.8,5.5,1023199,Guillermo del Toro,South Korea,Korean,244665453.0,1792009212.0,2020-11-13,TV-14,"Pedro Pascal, Zendaya, Robert Downey Jr., Adam Driver",New Line Cinema
NF5027,Sound Of Metal,Comedy,2010,162,4.3,3.5,473399,,India,Korean,227500328.0,421696494.0,2019-01-17,TV-MA,"Scarlett Johansson, Charlize Theron, Lupita Nyong'o",Marvel Studios
NF8997,Birds Of Prey,Horror,1997,138,6.8,3.1,1611841,Darren Aronofsky,South Korea,Hindi,77695144.0,126059277.0,2016-09-04,G,,Marvel Studios
NF9119,Project Power,Documentary,1999,157,4.5,6.2,1616782,James Gunn,France,Spanish,157683974.0,,2021-11-13,G,"Florence Pugh, Lupita Nyong'o",Netflix Originals
NF5331,Whiplash,Action,2000,78,6.2,6.2,1655751,Rian Johnson,France,French,223380990.0,267695647.0,2024-07-16,PG-13,"Zendaya, Tom Hanks, Charlize Theron, Florence Pugh",Paramount Pictures
NF7934,Mulan,Horror,2003,104,8.2,4.4,1221255,Kathryn Bigelow,France,Spanish,137145447.0,1201746550.0,2018-12-02,PG,"Lupita Nyong'o, Dwayne Johnson, Jodie Foster",Amazon Studios
NF1803,Hubie Halloween,Horror,2006,80,7.1,5.0,1017899,Jane Campion,Germany,German,175361123.0,1612734984.0,2015-12-27,TV-PG,"Morgan Freeman, Angelina Jolie",Pixar Animation Studios
NF6534,In The Heights,Fantasy,1998,199,7.7,6.2,187407,Tim Burton,Japan,Japanese,91499050.0,1439867176.0,2022-12-09,PG-13,"Tom Hanks, Dwayne Johnson, Robert De Niro, Brad Pitt",Focus Features
NF5928,Fear Street Part Three 1666,Romance,1993,137,6.1,9.0,942467,Jordan Peele,South Korea,Italian,1071491.0,,2020-06-03,PG-13,"Pedro Pascal, Florence Pugh, Robert Downey Jr.",Focus Features
NF2590,Luca,Crime,1992,84,4.4,5.6,1475608,Sam Raimi,France,Hindi,,794616191.0,2024-08-24,G,"Angelina Jolie, Julia Roberts, Cate Blanchett, Natalie Portman",Netflix Originals
NF5480,Those Who Wish Me Dead,Documentary,2014,163,4.4,9.6,851212,David Lynch,South Korea,Italian,2271052.0,298532162.0,2022-03-08,NC-17,"Morgan Freeman, Julia Roberts",Focus Features
NF7675,Schindler'S List,Crime,2013,129,6.1,5.0,1019655,James Gunn,United States,Japanese,,111412194.0,2021-02-04,R,"Leonardo DiCaprio, Lupita Nyong'o, Meryl Streep",DreamWorks Animation
NF2258,Crip Camp,Documentary,2011,137,8.8,6.2,1784388,James Cameron,South Korea,Japanese,38523094.0,1211969744.0,2020-10-25,G,"Ryan Reynolds, Brad Pitt",
NF3871,The Suicide Squad,Fantasy,2007,176,6.8,6.2,1334550,Kathryn Bigelow,France,Japanese,57394999.0,919280146.0,2020-12-12,PG,"Denzel Washington, Scarlett Johansson",Pixar Animation Studios
NF3564,The Power Of The Dog,Adventure,2023,185,6.8,8.9,72569,Kathryn Bigelow,France,English,240539287.0,101022871.0,2022-05-07,TV-14,"Robert Downey Jr., Pedro Pascal, Oscar Isaac",20th Century Studios
NF5883,Jungle Cruise,Animation,2003,85,6.8,6.2,1197522,Francis Ford Coppola,Japan,Korean,136392936.0,1599685835.0,2019-09-12,NR,"Florence Pugh, Lupita Nyong'o, Chris Evans",20th Century Studios
NF4330,The Lord Of The Rings: The Return Of The King,Fantasy,2010,93,8.7,7.6,1407826,Patty Jenkins,Italy,Korean,185903695.0,4867100.0,2020-04-24,TV-PG,"Florence Pugh, Will Smith",
NF9372,Gladiator,Crime,2004,75,5.7,8.1,125767,Coen Brothers,India,German,172846004.0,,2024-08-24,PG-13,"Natalie Portman, Meryl Streep, Zendaya",HBO Films
NF6570,Collective,Drama,2020,127,5.0,9.7,1988275,Alfred Hitchcock,United States,Hindi,165784999.0,367898969.0,2018-09-12,TV-MA,"Julia Roberts, Tom Hanks, Cate Blanchett, Leonardo DiCaprio",Walt Disney Pictures
NF9680,Spiral,Romance,2011,164,4.3,4.5,426245,Peter Jackson,South Korea,Japanese,,934700298.0,2024-05-09,PG,"Dwayne Johnson, Leonardo DiCaprio, Denzel Washington",
NF4542,The Old Guard,Sci-Fi,2021,145,7.8,7.2,510559,Chloé Zhao,United States,Italian,228916562.0,1961470277.0,2023-12-05,NR,"Margot Robbie, Viola Davis, Natalie Portman",Walt Disney Pictures
NF6094,Leon The Professional,Crime,2022,109,5.9,6.6,1439919,Paul Thomas Anderson,Italy,Hindi,63403048.0,,2015-10-23,TV-MA,,Netflix Originals
NF6688,The Umbrella Academy,Fantasy,1993,103,8.7,4.3,127215,Tim Burton,South Korea,Hindi,,1962272683.0,2015-07-20,TV-PG,"Ana de Armas, Will Smith, Oscar Isaac, Angelina Jolie",Pixar Animation Studios
NF3344,The Suicide Squad,Horror,2018,180,7.7,5.0,819110,Sam Raimi,South Korea,German,,613616924.0,2022-03-17,TV-14,"Pedro Pascal, Ryan Reynolds",Marvel Studios
NF7662,A Beautiful Mind,Comedy,2024,162,7.7,8.9,461121,Kathryn Bigelow,Italy,Japanese,167123150.0,1327854209.0,2024-01-06,NC-17,"Al Pacino, Scarlett Johansson, Angelina Jolie",20th Century Studios
NF3167,Zack Snyder'S Justice League,Action,2009,140,5.9,6.2,1728805,Tim Burton,United Kingdom,Korean,29519088.0,722263647.0,2019-11-11,NC-17,"Dwayne Johnson, Sandra Bullock, Morgan Freeman, Chris Evans",Focus Features
NF6989,Licorice Pizza,Fantasy,2003,105,4.6,9.4,1474069,Park Chan-wook,Germany,Korean,135674960.0,595265084.0,2015-12-02,TV-PG,"Robert De Niro, Pedro Pascal, Ryan Reynolds, Adam Driver",Paramount Pictures
NF2280,Bad Boys For Life,Animation,1993,137,8.1,5.7,1829744,Alfonso Cuaron,United Kingdom,Hindi,147050086.0,238201114.0,2024-08-09,G,"Zendaya, Robert Downey Jr., Sandra Bullock",Universal Pictures
NF6397,Thunder Force,Romance,2015,102,4.3,6.2,1217558,Billy Wilder,France,German,149524752.0,493999485.0,2020-09-02,TV-MA,"Jodie Foster, Tom Hanks, Charlize Theron, Oscar Isaac",Lionsgate
NF1979,The Unforgivable,Fantasy,1997,72,4.2,8.7,42952,Alfred Hitchcock,South Korea,Japanese,,489497815.0,2018-08-09,NR,"Will Smith, Tom Hanks",Legendary Pictures
NF6221,The Harder They Fall,Romance,2000,89,4.5,7.2,65097,Paul Thomas Anderson,France,Japanese,,408088084.0,2021-12-18,NR,"Ryan Reynolds, Dwayne Johnson, Chris Evans",Marvel Studios
NF1529,The Lovebirds,Documentary,1994,176,7.0,7.1,1499069,Martin Scorsese,United States,Japanese,192867457.0,1351443154.0,2022-07-26,PG-13,"Robert De Niro, Jodie Foster, Lupita Nyong'o",A24
NF6314,Three Billboards Outside Ebbing Missouri,Animation,2009,130,4.3,7.8,848590,Guillermo del Toro,Germany,Korean,23837676.0,,2020-03-27,NR,"Florence Pugh, Julia Roberts, Ana de Armas, Adam Driver",Pixar Animation Studios
NF4406,Call Me By Your Name,Horror,2007,137,4.9,9.2,1838076,Patty Jenkins,Japan,Korean,224149518.0,951308285.0,2017-06-11,TV-MA,"Robert De Niro, Charlize Theron, Denzel Washington",Legendary Pictures
NF3246,The Social Network,Drama,1995,137,5.5,3.2,472561,Coen Brothers,Japan,Korean,39701229.0,887149967.0,2018-09-01,NR,"Michael B. Jordan, Sandra Bullock",Marvel Studios
NF7590,My Hero Academia World Heroes Mission,Thriller,2016,187,6.1,5.2,1516986,Ryan Coogler,Germany,German,196271802.0,1329126638.0,2020-08-18,TV-14,"Dwayne Johnson, Will Smith, Timothée Chalamet",Walt Disney Pictures
NF9670,The Dark Knight,Animation,2007,94,9.3,4.6,145200,Quentin Tarantino,South Korea,French,147655304.0,1540864648.0,2016-08-19,TV-14,"Oscar Isaac, Tom Hanks, Robert Downey Jr.",Universal Pictures
NF3582,Spencer,Action,2014,137,4.2,6.2,841539,Wes Anderson,Italy,Hindi,193509181.0,,2015-11-13,TV-MA,"Florence Pugh, Timothée Chalamet, Sandra Bullock",Paramount Pictures
NF7881,Malcolm & Marie,Sci-Fi,2007,150,5.3,7.9,1168419,Rian Johnson,Germany,German,224460027.0,1612053407.0,2024-09-13,TV-MA,"Robert Downey Jr., Florence Pugh, Zendaya, Julia Roberts",DC Films
NF2917,The Conjuring The Devil Made Me Do It,Romance,1997,185,4.0,3.7,1480694,Wong Kar-wai,India,English,125606317.0,,2021-11-08,TV-PG,"Denzel Washington, Ryan Reynolds, Brad Pitt",Blumhouse Productions
NF6289,Titane,Drama,1994,144,8.7,5.8,438511,Tim Burton,United Kingdom,Hindi,85456751.0,1235209504.0,2024-06-05,TV-PG,"Oscar Isaac, Julia Roberts, Scarlett Johansson, Ryan Reynolds",Warner Bros.
NF9850,The Usual Suspects,Crime,1991,93,4.9,5.0,122761,Greta Gerwig,Japan,Hindi,27770434.0,1022918664.0,2022-06-27,PG,"Julia Roberts, Robert Downey Jr., Denzel Washington, Michael B. Jordan",Pixar Animation Studios
NF9138,Saving Private Ryan,Drama,2003,70,7.4,3.3,1286447,Spike Lee,Germany,Korean,48835650.0,1805472010.0,2018-05-22,TV-14,"Viola Davis, Pedro Pascal, Ryan Reynolds, Angelina Jolie",HBO Films
NF2880,Time,Comedy,2008,140,7.2,4.3,294823,Jane Campion,South Korea,Hindi,4476379.0,1716464983.0,2019-12-18,NR,"Timothée Chalamet, Sandra Bullock, Cate Blanchett, Chris Evans",Amazon Studios
NF5422,1917,Sci-Fi,2010,91,5.9,8.7,175129,David Fincher,United States,Hindi,,1602895885.0,2018-02-23,TV-MA,"Zendaya, Denzel Washington, Morgan Freeman, Pedro Pascal",Netflix Originals
NF6080,Halloween Kills,Drama,2020,98,8.2,9.5,822879,Paul Thomas Anderson,France,Spanish,5184044.0,924770550.0,2016-12-14,PG,"Lupita Nyong'o, Florence Pugh, Chris Evans, Natalie Portman",Warner Bros.
NF1549,Time,Fantasy,2016,200,8.0,5.4,567868,Tim Burton,United Kingdom,Japanese,41097157.0,622219360.0,2016-09-15,TV-PG,,20th Century Studios
NF2038,Marriage Story,Thriller,2000,137,6.7,8.5,502805,James Gunn,India,Hindi,182813400.0,1034824845.0,2021-06-09,NC-17,"Viola Davis, Tom Hanks",Warner Bros.
NF3722,To All The Boys Always And Forever,Sci-Fi,2007,138,8.6,7.4,1005451,Ryan Coogler,South Korea,French,194655180.0,,2018-08-24,PG-13,"Ryan Reynolds, Leonardo DiCaprio, Scarlett Johansson, Tom Hanks",Lionsgate
NF2431,Three Billboards Outside Ebbing Missouri,Crime,2013,89,8.8,5.3,362190,Chloé Zhao,India,Hindi,5840238.0,1341015275.0,2022-07-23,R,"Zendaya, Brad Pitt, Timothée Chalamet",Marvel Studios
NF9087,A Castle For Christmas,Action,1997,137,7.2,6.6,1851046,Tim Burton,Japan,Japanese,,1888871284.0,2019-08-07,R,"Ryan Reynolds, Leonardo DiCaprio, Angelina Jolie",Focus Features
NF5992,Once Upon A Time In Hollywood,Sci-Fi,1992,94,5.2,7.1,739990,Steven Spielberg,India,German,87213413.0,1156434033.0,2016-05-01,TV-PG,"Natalie Portman, Ryan Reynolds, Cate Blanchett",20th Century Studios
NF5140,The Addams Family 2,Fantasy,2009,177,5.5,3.9,220121,Patty Jenkins,United Kingdom,French,163977678.0,564875129.0,2023-04-12,NC-17,"Meryl Streep, Oscar Isaac",Lionsgate
NF1929,Shang-Chi And The Legend Of The Ten Rings,Fantasy,2006,175,7.4,7.9,1716632,Alfonso Cuaron,South Korea,Japanese,56776062.0,,2022-12-23,NC-17,"Leonardo DiCaprio, Meryl Streep, Morgan Freeman, Zendaya",Blumhouse Productions
NF3425,Dunkirk,Fantasy,2016,120,6.7,6.2,1693834,Paul Thomas Anderson,Germany,Korean,52917938.0,1987050388.0,2020-01-14,NR,"Charlize Theron, Al Pacino, Robert Downey Jr., Zendaya",Universal Pictures
NF3577,Summer Of Soul,Romance,2020,180,4.6,3.2,1691004,Ryan Coogler,Japan,Italian,,1594587184.0,2021-06-01,PG-13,"Lupita Nyong'o, Adam Driver",HBO Films
NF9072,The Trial Of The Chicago 7,Fantasy,2018,163,7.1,5.1,1205057,Jordan Peele,India,Korean,180853417.0,393572048.0,2020-03-17,R,"Ana de Armas, Sandra Bullock, Chris Evans",DreamWorks Animation
NF4020,Drive My Car,Drama,2011,177,8.8,6.5,1280152,Wong Kar-wai,South Korea,Hindi,44411721.0,1156958026.0,2018-11-25,TV-14,"Zendaya, Pedro Pascal, Brad Pitt, Viola Davis",
NF5060,A Castle For Christmas,Thriller,2013,102,5.7,8.9,918104,Akira Kurosawa,South Korea,German,85315650.0,257624334.0,2016-07-04,TV-MA,"Dwayne Johnson, Margot Robbie, Morgan Freeman, Zendaya",Paramount Pictures
NF2608,Murder Mystery,Horror,2014,132,9.3,6.6,1106226,David Lynch,United States,English,107943904.0,1151801548.0,2017-07-16,G,"Pedro Pascal, Morgan Freeman",20th Century Studios
NF6990,Halloween Kills,Animation,2007,83,7.6,5.0,640881,David Fincher,France,Korean,35825007.0,1096802199.0,2015-08-25,PG,"Viola Davis, Tom Hanks",Amazon Studios
NF8161,Spotlight,Comedy,1992,123,5.0,5.2,1949148,,Italy,German,196950685.0,1584524067.0,2023-04-26,TV-PG,"Ana de Armas, Pedro Pascal, Oscar Isaac",
NF9043,Extraction,Sci-Fi,2020,137,7.5,6.2,1646105,Jordan Peele,India,French,238197634.0,400783812.0,2022-09-01,NC-17,"Margot Robbie, Denzel Washington",Walt Disney Pictures
NF9718,Once Upon A Time In Hollywood,Sci-Fi,2005,137,4.2,5.5,798987,Tim Burton,Italy,English,45575591.0,1163542416.0,2017-12-11,NC-17,"Julia Roberts, Timothée Chalamet, Ana de Armas",Netflix Originals
NF6748,Kate,Comedy,2005,137,4.1,8.5,227326,Tim Burton,France,Hindi,57227768.0,704705500.0,2023-01-13,R,"Margot Robbie, Meryl Streep",Paramount Pictures
NF8337,Call Me By Your Name,Sci-Fi,2009,190,6.8,5.8,225,Francis Ford Coppola,Japan,Japanese,40030134.0,34079013.0,2020-05-12,TV-MA,"Lupita Nyong'o, Tom Hanks, Cate Blanchett, Margot Robbie",Amazon Studios
NF6431,Goodfellas,Horror,2009,137,4.9,6.2,1696477,,Italy,French,229058094.0,541375357.0,2017-09-10,NC-17,"Robert De Niro, Julia Roberts",Columbia Pictures
NF1831,Don'T Look Up,Adventure,2007,175,7.7,6.2,1948563,Alfonso Cuaron,Italy,Italian,77606753.0,1387155219.0,2015-02-21,NR,"Meryl Streep, Julia Roberts, Zendaya, Timothée Chalamet",20th Century Studios
NF7913,Army Of The Dead,Crime,2020,173,4.7,4.4,1024666,Zack Snyder,South Korea,Hindi,122726521.0,590167703.0,2019-12-24,TV-14,"Michael B. Jordan, Florence Pugh, Adam Driver, Robert Downey Jr.",DC Films
NF9438,The Silence Of The Lambs,Sci-Fi,2005,137,8.9,7.5,774746,Stanley Kubrick,France,Hindi,51264519.0,1728652233.0,2015-02-12,R,"Zendaya, Tom Hanks, Adam Driver",New Line Cinema
NF5338,Da 5 Bloods,Thriller,1997,147,5.2,6.1,1379576,Chloé Zhao,United States,French,221140962.0,358755976.0,2017-03-02,NR,"Brad Pitt, Margot Robbie, Natalie Portman",Blumhouse Productions
NF1767,Project Power,Adventure,2001,118,7.3,6.2,176328,Alfonso Cuaron,Italy,Hindi,114175575.0,1083906456.0,2017-08-24,TV-PG,"Denzel Washington, Margot Robbie, Meryl Streep, Viola Davis",Walt Disney Pictures
NF1010,Red Notice,Thriller,2012,115,4.9,6.2,1678027,Darren Aronofsky,United States,Korean,245293007.0,,2024-10-09,PG,"Chris Evans, Ryan Reynolds, Al Pacino",Warner Bros.
NF6993,The Green Mile,Romance,2008,160,5.9,9.6,1024666,Sofia Coppola,Germany,Japanese,170028067.0,,2016-05-17,NC-17,"Scarlett Johansson, Viola Davis",A24
NF8671,Passing,Romance,2012,181,7.5,7.9,1304848,Chloé Zhao,India,English,,520555056.0,2016-07-10,PG,"Brad Pitt, Sandra Bullock, Florence Pugh, Lupita Nyong'o",Universal Pictures
NF1378,He'S All That,Documentary,2019,70,9.2,6.2,907219,Rian Johnson,Italy,Italian,12167458.0,482313611.0,2015-05-14,TV-MA,"Timothée Chalamet, Sandra Bullock",New Line Cinema
NF2857,Otherhood,Adventure,1993,137,6.8,4.9,754316,Ridley Scott,India,Italian,172968356.0,1129575395.0,2023-10-09,NR,"Oscar Isaac, Viola Davis, Ana de Armas, Pedro Pascal",HBO Films
NF7636,Little Women,Adventure,2002,185,7.9,8.1,131305,J.J. Abrams,France,Korean,31089554.0,1852597879.0,2022-09-21,TV-14,"Timothée Chalamet, Robert De Niro, Viola Davis, Ana de Armas",HBO Films
NF6921,Last Night In Soho,Crime,2023,137,6.8,8.6,46375,Christopher Nolan,United States,Korean,156320666.0,1799387692.0,2018-04-26,TV-PG,"Morgan Freeman, Michael B. Jordan, Robert Downey Jr.",DreamWorks Animation
NF2103,The Favourite,Adventure,1992,142,5.2,6.2,1701996,J.J. Abrams,France,Italian,,933780228.0,2020-11-13,PG-13,,20th Century Studios
NF8108,Night At The Museum Secret Of The Tomb,Horror,2022,137,5.4,3.2,1380722,Guillermo del Toro,Italy,Korean,177212351.0,72791859.0,2020-12-04,G,"Zendaya, Pedro Pascal",Walt Disney Pictures
NF2850,The Prestige,Crime,2014,137,7.0,5.5,1112643,Alfonso Cuaron,India,German,66362693.0,1497700835.0,2017-12-22,PG,"Robert De Niro, Zendaya, Pedro Pascal",Warner Bros.
NF4546,C'Mon C'Mon,Crime,2008,131,8.1,4.8,43196,Jane Campion,United Kingdom,Spanish,213677510.0,,2021-05-21,NR,"Natalie Portman, Robert Downey Jr.",Lionsgate
NF8255,Marriage Story,Animation,1992,122,6.2,6.4,1844213,Greta Gerwig,United Kingdom,Italian,33571975.0,,2024-07-06,G,"Jodie Foster, Ryan Reynolds, Sandra Bullock",Netflix Originals
NF6528,Marriage Story,Sci-Fi,1991,95,4.9,9.7,257902,Stanley Kubrick,United States,Italian,163703519.0,1005222894.0,2024-12-01,R,"Angelina Jolie, Natalie Portman, Cate Blanchett",A24
NF2348,C'Mon C'Mon,Adventure,2007,139,8.4,4.2,436819,Guillermo del Toro,South Korea,Korean,35544245.0,169542489.0,2022-10-27,NR,"Al Pacino, Margot Robbie",Blumhouse Productions
NF3063,Vice,Thriller,2022,137,7.7,9.2,1294168,David Lynch,United Kingdom,French,136373237.0,66268326.0,2024-09-18,NC-17,"Will Smith, Scarlett Johansson",20th Century Studios
NF9524,Candyman,Adventure,2021,161,9.0,3.1,275258,Park Chan-wook,France,French,213135015.0,,2019-09-20,G,"Angelina Jolie, Tom Hanks, Denzel Washington, Robert De Niro",Marvel Studios
NF6177,Mass,Romance,2017,117,6.1,5.4,291147,Sofia Coppola,South Korea,Japanese,,1636922743.0,2021-05-17,PG-13,"Timothée Chalamet, Dwayne Johnson, Pedro Pascal, Robert De Niro",Universal Pictures
NF3209,C'Mon C'Mon,Animation,1992,121,5.7,8.5,76899,Bong Joon-ho,United States,Korean,99289394.0,859140221.0,2022-07-11,TV-PG,"Oscar Isaac, Lupita Nyong'o, Margot Robbie, Brad Pitt",Paramount Pictures
NF5184,Alex Rider,Action,2011,137,7.5,4.1,204566,Kathryn Bigelow,United Kingdom,French,181952884.0,552958179.0,2015-04-02,TV-PG,"Jodie Foster, Charlize Theron, Brad Pitt, Oscar Isaac",Amazon Studios
NF4700,A Boy Called Christmas,Drama,1992,93,6.6,7.8,1772885,Paul Thomas Anderson,South Korea,French,242433617.0,1906108353.0,2024-08-09,PG,,Netflix Originals
NF9117,Welcome To Chechnya,Sci-Fi,2015,137,8.2,5.1,126339,Quentin Tarantino,France,Korean,212583090.0,1823292611.0,2020-10-21,PG-13,"Chris Evans, Pedro Pascal, Michael B. Jordan",Warner Bros.
NF5171,Otherhood,Adventure,2007,146,5.4,6.5,1916716,Peter Jackson,India,Korean,187117028.0,942798334.0,2021-02-19,PG-13,"Timothée Chalamet, Tom Hanks, Angelina Jolie",New Line Cinema
NF8917,Murder Mystery,Crime,2002,102,8.8,4.5,884418,Jane Campion,Italy,French,,718396459.0,2019-11-01,NR,"Margot Robbie, Dwayne Johnson, Will Smith, Al Pacino",New Line Cinema
NF4868,Army Of The Dead,Thriller,2009,188,6.3,4.4,61214,Stanley Kubrick,India,Spanish,130917209.0,118914413.0,2016-06-20,PG,"Lupita Nyong'o, Brad Pitt, Timothée Chalamet",Columbia Pictures
NF5789,Marriage Story,Action,2015,110,8.0,8.0,36208,Greta Gerwig,France,Spanish,120930637.0,742338478.0,2019-07-08,NC-17,"Brad Pitt, Viola Davis, Florence Pugh, Oscar Isaac",Legendary Pictures
NF4752,Spotlight,Romance,2005,126,6.8,3.0,146869,Bong Joon-ho,France,German,,1785133241.0,2018-04-17,TV-PG,"Jodie Foster, Sandra Bullock, Chris Evans",Focus Features
NF4714,Mulan,Horror,1999,137,6.8,6.2,1262722,Zack Snyder,Italy,Hindi,30063923.0,1367702716.0,2024-06-01,G,"Charlize Theron, Zendaya",Amazon Studios
NF5417,The Devil All The Time,Sci-Fi,2005,192,7.5,3.1,705124,Taika Waititi,Italy,Korean,,1605724177.0,2022-01-20,R,"Adam Driver, Morgan Freeman",Paramount Pictures
NF7366,Kate,Sci-Fi,2021,192,9.4,4.7,1854847,Christopher Nolan,United States,Hindi,102886897.0,342596146.0,2016-01-12,R,"Lupita Nyong'o, Cate Blanchett, Margot Robbie",Warner Bros.
NF2150,Coming 2 America,Action,2016,137,7.3,7.3,1343001,Martin Scorsese,United States,German,248090422.0,1666421460.0,2020-12-27,PG,,Paramount Pictures
NF1883,Those Who Wish Me Dead,Drama,1997,187,4.8,8.3,439804,Akira Kurosawa,France,Korean,37276552.0,1770837727.0,2018-09-28,TV-14,"Florence Pugh, Julia Roberts",Walt Disney Pictures
NF8918,Leon The Professional,Horror,1992,123,8.7,5.1,1198350,Alfonso Cuaron,South Korea,Hindi,23056135.0,1114259023.0,2020-04-19,NR,"Charlize Theron, Florence Pugh, Adam Driver, Ana de Armas",Blumhouse Productions
NF4419,Coming 2 America,Drama,1993,162,6.3,7.8,557555,Ryan Coogler,United Kingdom,French,26570251.0,,2018-09-13,NR,"Chris Evans, Julia Roberts, Zendaya, Angelina Jolie",New Line Cinema
NF7471,Call Me By Your Name,Adventure,1990,137,5.0,6.2,894424,Jane Campion,United Kingdom,Korean,66235786.0,,2022-08-21,G,"Leonardo DiCaprio, Angelina Jolie",Paramount Pictures
NF7514,Welcome To Chechnya,Sci-Fi,2004,77,8.2,6.0,1062816,Bong Joon-ho,United Kingdom,Italian,225073411.0,483988590.0,2024-11-03,R,"Julia Roberts, Charlize Theron, Al Pacino, Morgan Freeman",Marvel Studios
NF7592,Army Of The Dead,Adventure,2021,180,9.0,5.4,770712,Patty Jenkins,Italy,Japanese,161652742.0,1624651281.0,2021-06-20,TV-14,"Meryl Streep, Charlize Theron",Amazon Studios
NF2210,Greyhound,Crime,2000,122,5.2,9.1,521505,Steven Spielberg,South Korea,French,223317209.0,1954331075.0,2017-06-09,TV-PG,"Robert Downey Jr., Robert De Niro",DC Films
NF4522,Mad Max Fury Road,Romance,2009,173,4.7,6.2,1738866,Christopher Nolan,Italy,English,218132063.0,1117193341.0,2015-09-21,TV-14,"Florence Pugh, Scarlett Johansson, Jodie Foster, Meryl Streep",Universal Pictures
NF5794,The Conjuring The Devil Made Me Do It,Comedy,1999,84,5.5,6.2,1024008,Jordan Peele,Italy,English,169651965.0,302089378.0,2023-07-07,PG,"Morgan Freeman, Tom Hanks",Universal Pictures
NF8326,The Godfather,Drama,2010,99,4.7,8.7,1260611,Rian Johnson,United States,Hindi,210638763.0,1207538370.0,2020-05-22,TV-14,"Florence Pugh, Timothée Chalamet, Robert Downey Jr.",Apple TV+
NF5800,Catch Me If You Can,Crime,1998,146,4.2,3.8,974748,Denis Villeneuve,United Kingdom,German,63586496.0,927854627.0,2022-06-22,TV-PG,"Adam Driver, Will Smith, Robert Downey Jr.",Columbia Pictures
NF7541,Parallel Mothers,Romance,2019,188,5.6,6.1,1492533,Billy Wilder,France,Japanese,166322383.0,983278464.0,2021-11-06,PG,"Meryl Streep, Chris Evans, Jodie Foster",Pixar Animation Studios
NF9304,Summer Of Soul,Animation,2021,75,5.8,8.3,663105,,France,Hindi,22948845.0,1424688119.0,2017-06-27,NR,"Charlize Theron, Ana de Armas",Focus Features
NF4078,The Harder They Fall,Romance,2013,171,6.8,6.2,1344875,Paul Thomas Anderson,Italy,Hindi,149064531.0,1034617816.0,2024-09-21,TV-14,,20th Century Studios
